{
  "revision": 14,
  "task": "continuation-gate fixture: a lifecycle resting at closeout",
  "task_verbatim": "continuation-gate fixture: a lifecycle resting at closeout",
  "phase": "closeout",
  "artifact_index": [],
  "gate_history": [
    {
      "gate": "ground_truth",
      "round": 2,
      "verdict": "PASS",
      "findings_count": 0
    }
  ],
  "amendments": [],
  "escalations": [
    {
      "gate_type": "intent",
      "segment": 0,
      "resolved": true
    }
  ],
  "budget": {
    "total_tokens": 0
  },
  "feedback_marker": {
    "session_file": null,
    "line": 0
  },
  "signature_history": []
}
