{
  "revision": 9,
  "task": "continuation-gate fixture: mid-phase, every escalation resolved",
  "task_verbatim": "continuation-gate fixture: mid-phase, every escalation resolved",
  "phase": "implement",
  "artifact_index": [],
  "gate_history": [],
  "amendments": [],
  "escalations": [
    { "gate_type": "spec_traceable", "segment": 3, "resolved": true }
  ],
  "budget": { "total_tokens": 0 },
  "feedback_marker": { "session_file": null, "line": 0 },
  "signature_history": []
}
